status_id,status_message,link_name,status_type,status_link,status_published,num_reactions,num_comments,num_shares,num_likes,num_loves,num_wows,num_hahas,num_sads,num_angrys,impact_score,page_id,Source type,auckland ,council ,mayor ,goff,councillor,local board ,tier1
146947065366187_1472813962779484,"Our draft local board plan drives us and guides us over the next three years, and we need to know what matters most to you. Help shape the future of Manugakiekie-Tamaki , submit your feedback by going to www.shapeauckland.co.nz  
Submissions close  Friday the 30th of June, 4pm. We look forward to hearing from our communities.",,video,https://www.facebook.com/maungakiekietamaki/videos/1472813962779484/,42914.68252,31,2,4,27,4,0,0,0,0,101,1.46947E+14,Local,0,0,0,0,0,1,1
146947065366187_1469756679751879,"There is still time to have your say on what matters most to you and your community. Visit www.shapeauckland.co.nz to submit your feedback, or share your thoughts below, including the phrase ""Local Board Plan Feedback"" in your post. Submissions close Friday 30 June.",Have your say on Maungakiekie-TéÅmaki waterways,link,http://ourauckland.aucklandcouncil.govt.nz/articles/news/2017/06/have-your-say-on-maungakiekie-tamaki-waterways/,42912.74385,1,0,0,1,0,0,0,0,0,3,1.46947E+14,Local,0,0,0,0,0,1,1
146947065366187_143275046223780,"At the time of the close of the agenda there were no requests for petitions, deputations, public forum or extra ordinary business.

Following are items that may be of interest to members of the public.
Item 15 - Relationship Agreement with Mana Whenua Template
Item 17 - Maungakiekie-TéÅmaki Local Board Local Grants: Round Two 2016/2017 grant applications
Items 18-22 - 2017/18 Works Programmes for; Libraries; Environment; Arts, Culture and Events; Parks, Sport and Recreation; and Community Facitilites.
Item 23 - Project 17: Auckland Council Maintenance Contracts
Item 24 - Auckland Plan refresh 2018: early feedback to inform draft plan
Item 25 -  Change in appointment to Manukau Harbour Forum

For further details on any of these items or to read the full agenda please go to http://infocouncil.aucklandcouncil.govt.nz/",Maungakiekie-TéÅmaki Local Board Business Meeting,event,https://www.facebook.com/events/143275046223780/,42912.04221,0,0,0,0,0,0,0,0,0,0,1.46947E+14,Local,1,1,0,0,0,1,1
146947065366187_1466040256790188,"This article is in response to a media statement, made by our Local Board Chair Josephine Bartley, that was issued this afternoon.",East & Bays Courier,link,http://www.stuff.co.nz/business/94018374/government-intervention-with-pt-england-needs-to-stop-local-board-chair-says,42908.91206,9,0,0,9,0,0,0,0,0,27,1.46947E+14,Local,0,0,0,0,0,1,1
146947065366187_1465970583463822,"One week left to have your say! 
Now's the time to be heard. Whether you care about local community events, parks and playgrounds, or a town centre to be proud of, we want to hear from you.
Visit www.shapeauckland.co.nz to submit your feedback, or share your thoughts below, including the phrase ""Local Board Plan Feedback"" in your post. Submissions close Friday 30 June.",Shape Auckland,link,http://www.shapeauckland.co.nz/,42908.83315,17,2,4,17,0,0,0,0,0,59,1.46947E+14,Local,0,0,0,0,0,1,1
146947065366187_1464112486982965,"Keep sending those submissions to us about what you want for your community for the next three years, these guys gave up their evening last night to talk to Local board members Don Allan (Deputy Chair),  Debbie Burrows Chris Makoare Nerissa Henry and Chair Josephine Bartley joined by Governing body councillor Denise Lee - submissions due 30 June.",Timeline Photos,photo,https://www.facebook.com/maungakiekietamaki/photos/a.383379868389571.84409.146947065366187/1464112486982965/?type=3,42906.91502,8,1,4,8,0,0,0,0,0,30,1.46947E+14,Local,0,0,0,0,1,1,1
146947065366187_1462003163860564,"We need to know what matters to you and your whanau. More training programmes for our youth, community events, a town centre to be proud of? It's easy to have your say on the draft Local Board Plan. Simply post your thoughts below using the words ""Local Board Plan Feedback"" in your comment. Help us shape our community for our people. www.shapeauckland.co.nz",Timeline Photos,photo,https://www.facebook.com/maungakiekietamaki/photos/a.383379868389571.84409.146947065366187/1462003163860564/?type=3,42904.79758,59,14,3,59,0,0,0,0,0,208,1.46947E+14,Local,0,0,0,0,0,1,1
146947065366187_1461968553864025,Get your questions and comments together and come and have a chat with us about the Maungakiekie-TéÅmaki Draft Local Board Plan tomorrow night.,Have Your Say - Draft Local Board Plan,event,https://www.facebook.com/events/1841143839544575/,42904.75748,0,0,0,0,0,0,0,0,0,0,1.46947E+14,Local,0,0,0,0,0,1,1
146947065366187_1456818104379070,"Lobbying for better-connected public transport options and providing more recreational cycleways across our area are a key focus of the draft Maungakiekie-Tamaki Local Board Plan. 
But what do you think matters most? 
Ways to have your say:
www.shapeauckland.co.nz to fill out a submission form
post a comment below including the words 'Local Board Plan feedback'
send a private message including the words 'Local Board Plan feedback'.",Help Shape Maungakiekie-TéÅmaki,link,http://shapeauckland.co.nz/consultations/draft-maungakiekie-t%C4%81maki-local-board-plan-2017/,42899.8056,47,10,5,47,0,0,0,0,0,166,1.46947E+14,Local,0,0,0,0,0,1,1
146947065366187_1448566365204244,"Have your say on the Draft Maungakiekie-TéÅmaki Local Board Plan. There's lots of great things going on in our area and we want you to help us do more. What do we need, what are we doing right and what can we do better? Make your voice heard in one of the following ways:
Visit www.shapeauckland.co.nz to fill out submission form
Come to one of our Have Your Say events 
Post a comment below and include the words 'Local Board Plan feedback'",Draft Local Board Plan 2017,video,https://www.facebook.com/maungakiekietamaki/videos/1448566365204244/,42891.9845,1,2,0,1,0,0,0,0,0,7,1.46947E+14,Local,0,0,0,0,0,1,1
146947065366187_1443029515757929,"There's lots of cool stuff going on for young people in the Maungakiekie-Tamaki Local Board area and we want you to help us do more. What do we need, what are we doing right and what can we do better? Make your voice heard in one of the following ways:
# Visit www.shapeauckland.co.nz to fill out submission form
# Write something on our Facebook page and include the 
words 'Local Board Plan feedback'
# send a private message include 'Local Board Plan feedback'.",,video,https://www.facebook.com/maungakiekietamaki/videos/1443029515757929/,42887.08611,9,0,1,8,1,0,0,0,0,28,1.46947E+14,Local,0,0,0,0,0,1,1
146947065366187_1441083279285886,Talofa! Manuia le vaiaso o le gagana Samoa! (Happy Samoa language week) from the Maungakiekie Tamaki Local board #celebratingdiversity,Manuia le vaiaso o le gagana Samoa!,video,https://www.facebook.com/maungakiekietamaki/videos/1441083279285886/,42884.95833,19,0,10,16,3,0,0,0,0,67,1.46947E+14,Local,0,0,0,0,0,1,1
146947065366187_1433380950056119,It's Local Board Plan consultation time.  We need to hear from you.,Help shape the future of your local area,link,http://ourauckland.aucklandcouncil.govt.nz/articles/news/2017/05/help-shape-the-future-of-your-local-area/,42876.74175,0,0,1,0,0,0,0,0,0,1,1.46947E+14,Local,0,0,0,0,0,1,1
146947065366187_1841143839544575,"We're developing our Local Board Plan 2017 and want to know what you think about the projects and outcomes we propose focusing on over the next three years. 

Visit the Onehunga Community Centre, meet our Local Board members and staff and have a chat, or give your feedback on the plan.

Just go online to www.shapeauckland.co.nz to read the draft Maungakiekie- TéÅmaki Local Board Plan and to make a submission. Feedback is accepted from 22 May to 30 June.",Have Your Say - Draft Local Board Plan,event,https://www.facebook.com/events/1841143839544575/,42872.99948,2,0,0,2,0,0,0,0,0,6,1.46947E+14,Local,0,0,0,0,0,1,1
146947065366187_1427799890646473,"We're developing our Local Board Plan 2017 and want to know what you think about the projects and outcomes we propose focusing on over the next three years. 

Visit the Panmure Community Hall, meet our Local Board members and staff and have a chat, or give your feedback on the plan.

Just go online to www.shapeauckland.co.nz to read the draft Maungakiekie- TéÅmaki Local Board Plan and to make a submission. Feedback is accepted from 22 May to 30 June.",Have Your Say - Draft Local Board Plan,event,https://www.facebook.com/events/1427799890646473/,42872.99351,1,0,0,1,0,0,0,0,0,3,1.46947E+14,Local,0,0,0,0,0,1,1
146947065366187_1421058121288402,"CALLING ALL HIGH SCHOOL STUDENTS WHO WANT TO MAKE A CHANGE AND GET INVOLVED WITH SOCIAL ENTERPRISE!

Social Innovation New Zealand is running the AdviSE Case Competition in a couple of weeks! This competition gives students an opportunity to compete in teams and learn more about social enterprises in the Auckland community. Teams are challenged to prepare and deliver a 10 minute presentation that identifies the key issues faced by the social enterprise and come up with potential  solutions.

This is an awesome opportunity to develop your knowledge of social enterprise while honing your case consulting, public speaking, and critical thinking skills in a very short time! Make sure to check out the event page below for more details!",AdviSE: Social Enterprise Competition for High Schools,event,https://www.facebook.com/events/1902756563275698/,42862.97556,13,0,0,9,3,1,0,0,0,39,1.46947E+14,Local,1,0,0,0,0,0,1
146947065366187_1418354138225467,"Two of our Local Board Member heroes have been recognised nationally as 'local heroes'.  What ever way you look at it, they are without-a-doubt our heroes!",Maungakiekie-Tamaki loacal board members gain 'local heroes' accolade,link,http://www.stuff.co.nz/auckland/92011333/maungakiekietamaki-loacal-board-members-gain-local-heroes-accolade,42859.92506,6,0,0,6,0,0,0,0,0,18,1.46947E+14,Local,0,0,0,0,0,1,1
146947065366187_1402432366484311,"Did you know that 50 per cent of the contents of a typical household bin in Auckland can be composted? 
Find out how to put your food scraps and green waste to better use at a free workshop hosted by the Compost Collective. This insightful course will run from 10am until 12pm on Saturday 20th April at the Athol Syms Hall. Be sure to book ahead to secure your spot by calling (09) 482 1672 or visiting compostcollective.org.nz/events-calendar/.",Timeline Photos,photo,https://www.facebook.com/maungakiekietamaki/photos/a.383379868389571.84409.146947065366187/1402432366484311/?type=3,42858.83333,2,1,0,2,0,0,0,0,0,8,1.46947E+14,Local,1,0,0,0,0,0,1
147669708631237_1499808460084015,"Register your dog now for a discounted rate. 
Auckland Council's early-bird rates are on offer until 1 August and applications can be completed online, by post or in person.",Register your dog and save,link,http://ourauckland.aucklandcouncil.govt.nz/articles/news/2017/06/register-your-dog-and-save/,42912.82089,2,0,0,2,0,0,0,0,0,6,1.4767E+14,Local,1,0,0,0,0,0,1
147669708631237_1495122857219242,"Congratulations to Veisinia Maka, who will represent the Howick Local Board area on the Auckland Council Advisory Panel.",Young Aucklanders step up,link,http://ourauckland.aucklandcouncil.govt.nz/articles/news/2017/06/young-aucklanders-step-up/,42911.62986,5,0,0,4,1,0,0,0,0,15,1.4767E+14,Local,1,1,0,0,0,1,1
147669708631237_1495951857136342,"One week left to have your say! 
Now's the time to be heard. Whether you care about local community events, parks and playgrounds, or a town centre to be proud of, we want to hear from you.
Visit www.shapeauckland.co.nz to submit your feedback, or share your thoughts below, including the phrase ""Local Board Plan Feedback"" in your post.",Shape Auckland,link,http://www.shapeauckland.co.nz/,42908.81662,37,10,13,37,0,0,0,0,0,144,1.4767E+14,Local,0,0,0,0,0,1,1
147669708631237_1493828897348638,"What matters most to you?  More shared pathways,better transport options, community events?  Now is the time to make your voice heard, and have your say on the draft Howick Local Board Plan. Simply post your thoughts below using the words ""Local Board Plan Feedback"" in your comment. www.shapeauckland.co.nz",Timeline Photos,photo,https://www.facebook.com/HowickLB/photos/a.210846688980205.53552.147669708631237/1493828897348638/?type=3,42906.77005,244,19,19,235,9,0,0,0,0,789,1.4767E+14,Local,0,0,0,0,0,1,1
147669708631237_1905387639721644,"Have we got it right? 
We're developing our Local Board Plan 2017 and want to know what you think about some of the projects and outcomes we propose focusing on over the next three years.
Come on down to the Botany Town Centre,  have a chat, and submit your feedback.

Social media
Comments made through Facebook will be considered:
write something on the Howick Local Board Facebook page - Facebook.com/HowickLB and include 'Local Board Plan feedback'
OR send a private message using Facebook Messenger
to @HowickLB and include 'Local Board Plan feedback'.",Local Board Plan - Botany Town Centre,event,https://www.facebook.com/events/1905387639721644/,42904.7638,7,0,0,7,0,0,0,0,0,21,1.4767E+14,Local,0,0,0,0,0,1,1
147669708631237_1487861981278663,"We need to know what matters to you and your family. Whether it's better transport systems, playgrounds, or coastal erosion programmes. It's easy to have your say on the draft Howick Local Board Plan. Simply post your thoughts below using the words ""Local Board Plan Feedback"" in your comment, or visit www.shapeauckland.co.nz to make a submission.
Help us shape our community for our people.",Timeline Photos,photo,https://www.facebook.com/HowickLB/photos/a.210846688980205.53552.147669708631237/1487861981278663/?type=3,42900.95833,94,12,10,89,4,1,0,0,0,316,1.4767E+14,Local,0,0,0,0,0,1,1
147669708631237_1485495041515357,"Do you support the Howick Local Board working with community organisations and the NZ Police to improve community safety in our area? Have your say on this and other proposed initiatives in the draft Howick Local Board Plan. www.shapeauckland.co.nz or post your feedback below, including the phrase ""local board plan feedback"".",Shape Auckland,link,http://www.shapeauckland.co.nz/,42898.81763,19,2,3,19,0,0,0,0,0,64,1.4767E+14,Local,0,0,0,0,0,1,1
147669708631237_1484297018301826,History buffs rejoice - Check out Manukau's Journey now at Auckland Libraries.,A timeline of Manukau from 1769 to today,link,http://ourauckland.aucklandcouncil.govt.nz/articles/news/2017/05/a-timeline-of-manukau/,42897.73156,6,0,1,5,1,0,0,0,0,19,1.4767E+14,Local,1,0,0,0,0,0,1
147669708631237_1479624688769059,"From now until 30 June, Auckland's 21 local boards want to know what you value most in your local community. Find out what's being proposed for your neighbourhood and surrounding areas, then share your feedback online at Shape Auckland by 30 June 2017",Help shape your local area: South and east Auckland,link,http://ourauckland.aucklandcouncil.govt.nz/articles/news/2017/06/help-shape-your-local-area-south-and-east-auckland/,42895.84028,0,0,1,0,0,0,0,0,0,1,1.4767E+14,Local,1,0,0,0,0,0,1
147669708631237_997731843696284,"Have we got it right? 
We're developing our Local Board Plan 2017 and want to know what you think about some of the projects and outcomes we propose focusing on over the next three years.
Come on down to the Pakuranga Library, have a chat, and submit your feedback.

Social media
Comments made through Facebook will be considered:
write something on the Howick Local Board Facebook page - Facebook.com/HowickLB and include 'Local Board Plan feedback'
OR send a private message using Facebook Messenger
to @HowickLB and include 'Local Board Plan feedback'.",Local Board Plan - Pakuranga Library,event,https://www.facebook.com/events/997731843696284/,42894.69575,6,0,0,6,0,0,0,0,0,18,1.4767E+14,Local,0,0,0,0,0,1,1
147669708631237_1479449275453267,"Come on down to the Howick Library tonight, and chat to local board members about your thoughts, ideas and feedback for the draft Howick Local Board Plan. This is your chance to have a voice and shape our area for the next three years.
www.shapeauckland.co.nz",Local Board Plan - Howick Library,event,https://www.facebook.com/events/165113800691394/,42893.67164,3,0,0,3,0,0,0,0,0,9,1.4767E+14,Local,0,0,0,0,0,1,1
147669708631237_1478420058889522,"Would you support paying a targeted rate so that Howick residents of all ages have free entry to our swimming pools This is one of our ideas in our draft local board plan, and we want to know what you think. 
Visit www.shapeauckland.co.nz or submit your feedback via our Facebook page and include the words 'Local Board Plan feedback'",Shape Auckland,link,http://www.shapeauckland.co.nz/,42892.79238,12,6,0,12,0,0,0,0,0,48,1.4767E+14,Local,0,0,0,0,0,1,1
147669708631237_1477484382316423,"Work gets underway soon on a new pathway linking the residential suburbs of Pakuranga and Burswood and the industrial/business area of Highbrook.  Local board members recently turned the sod to kick off the project.   Great for recreational use, the new path will also provide an alternative pedestrian and cycling route - away from busy roads.  Work is expected to be finished in October this year.",Timeline Photos,photo,https://www.facebook.com/HowickLB/photos/a.210846688980205.53552.147669708631237/1477484382316423/?type=3,42891.99324,27,4,1,26,1,0,0,0,0,90,1.4767E+14,Local,0,0,0,0,0,1,1
147669708631237_1476351102429751,"Matariki at Auckland Libraries É?? 10 June - 2 July 2017.
Check in with your local library to discover stories of Matariki;",Matariki at Auckland Libraries,link,http://ourauckland.aucklandcouncil.govt.nz/articles/events/2017/06/matariki-at-auckland-libraries/,42890.90904,1,0,0,1,0,0,0,0,0,3,1.4767E+14,Local,1,0,0,0,0,0,1
147669708631237_1472629786135216,Do you support the progression of a new park and urban forest on the former Greenmount landfill site? Have your say on this and other proposed initiatives in the draft Howick Local Board Plan. Visit www.shapeauckland.co.nz or submit your feedback via our Facebook page and include the words 'Local Board Plan feedback',Shape Auckland,link,http://www.shapeauckland.co.nz/,42887.95833,4,0,0,4,0,0,0,0,0,12,1.4767E+14,Local,0,0,0,0,0,1,1
147669708631237_1468881353176726,"As a young person, now's the chance to have a voice and help shape the future of your community.You can submit your feedback to our Facebook page, simply use the phrase ""Local Board Plan Feedback"" in your comment, or visit www.shapeauckland.co.nz by 30 June.",,video,https://www.facebook.com/HowickLB/videos/1468881353176726/,42885.90556,14,1,6,12,2,0,0,0,0,50,1.4767E+14,Local,0,0,0,0,0,1,1
147669708631237_1468772783187583,"Protecting our unique environment and much admired coastal areas is important to the Howick Local Board, do you agree?
Help shape our area and have your say on the draft Howick Local Board Plan. www.shapeauckland.co.nz",Shape Auckland,link,http://www.shapeauckland.co.nz/,42883.75528,4,0,2,4,0,0,0,0,0,14,1.4767E+14,Local,0,0,0,0,0,1,1
147669708631237_165113800691394,"Have we got it right? 
We're developing our Local Board Plan 2017 and want to know what you think about some of the projects and outcomes we propose focusing on over the next three years.
Come on down to the Howick Library, have a chat, and submit your feedback.

Social media
Comments made through Facebook will be considered:
write something on the Howick Local Board Facebook page - Facebook.com/HowickLB and include 'Local Board Plan feedback'
OR send a private message using Facebook Messenger
to @HowickLB and include 'Local Board Plan feedback'.


Have your say by 4pm on Friday 30 June
For more information and to provide feedback visit
shapeauckland.co.nz or your local public library, service
centre or local board office.",Local Board Plan - Howick Library,event,https://www.facebook.com/events/165113800691394/,42883.66023,2,0,0,2,0,0,0,0,0,6,1.4767E+14,Local,0,0,0,0,0,1,1
147669708631237_1458174224247439,"If your community group is organising an event, or running a programme that benefits our community, then you could be eligible for a Howick Local Board Grant. 
Applications open 29 May - 7 July 2017",Find a grant or fund,link,http://www.aucklandcouncil.govt.nz/EN/newseventsculture/communityfundingsupport/Pages/findagrant.aspx,42880.71181,14,6,3,13,1,0,0,0,0,57,1.4767E+14,Local,0,0,0,0,0,1,1
147669708631237_1465936816804513,"Would you like to see more local events, public art and signage to help generate a sense of pride and belonging in the area?  To have your say on this and other proposed initiatives in the draft Howick Local Board Plan visit www.shapeauckland.co.nz by 30 June.",Timeline Photos,photo,https://www.facebook.com/HowickLB/photos/a.210846688980205.53552.147669708631237/1465936816804513/?type=3,42880.69109,10,0,0,10,0,0,0,0,0,30,1.4767E+14,Local,0,0,0,0,0,1,1
147669708631237_1465062250225303,Funding from Howick Local Board has helped with the creation of the colourful mosaic which now has pride of place on the Howick RSA building.,New mosaic on display at the RSA - Times,link,http://www.times.co.nz/news/new-mosaic-display-rsa/,42879.81763,3,0,1,3,0,0,0,0,0,10,1.4767E+14,Local,0,0,0,0,0,1,1
147669708631237_1464235750307953,"Youth Week in Auckland É?? 25 May - 3 June 2017.
Make the most of being active in Auckland during Youth Week 2017.",Youth Week 2017,link,http://ourauckland.aucklandcouncil.govt.nz/articles/events/2017/05/youth-week-2017/,42879.04931,3,0,1,3,0,0,0,0,0,10,1.4767E+14,Local,1,0,0,0,0,0,1
147669708631237_1462177880513740,"Consultation is now open for our Draft Local Board Plan 2017. Your feedback will guide decisions for our area, so make sure to have your say.",Help shape the future of your local area,link,http://ourauckland.aucklandcouncil.govt.nz/articles/news/2017/05/help-shape-the-future-of-your-local-area/,42876.75682,7,1,0,7,0,0,0,0,0,23,1.4767E+14,Local,0,0,0,0,0,1,1
147669708631237_1933315266899787,"Have we got it right? 
We're developing our Local Board Plan 2017 and want to know what you think about some of the projects and outcomes we propose focusing on over the next three years.
Come on down to the Howick Village Markets, have a chat, and submit your feedback.

Have your say by 4pm on Friday 30 June
For more information and to provide feedback visit
shapeauckland.co.nz or your local public library, service
centre or local board office.",Local Board Plan - Howick Village Market,event,https://www.facebook.com/events/1933315266899787/,42872.84759,3,0,0,3,0,0,0,0,0,9,1.4767E+14,Local,0,0,0,0,0,1,1
147669708631237_1452389071492621,"Should more businesses be allowed to open on Easter Sunday?  Auckland Council wants to know your views.  Go to shapeauckland.co.nz to have your say. Feedback closes 11 June 2017.

http://ourauckland.aucklandcouncil.govt.nz/articles/news/2017/05/we-want-your-feedback-on-easter-sunday-trading-in-auckland/",We want your feedback on Easter Sunday trading in Auckland,link,http://ourauckland.aucklandcouncil.govt.nz/articles/news/2017/05/we-want-your-feedback-on-easter-sunday-trading-in-auckland/,42866.8502,4,0,0,4,0,0,0,0,0,12,1.4767E+14,Local,1,1,0,0,0,0,1
147669708631237_1517539028287616,"We're developing our Local Board Plan 2017 and want to know what you think about some of the projects and outcomes we propose focusing on over the next three years.
These include continued investment in upgrading sportsfields and community facilities, improving public transport and investigating a local targeted rate to allow free access to our swimming pools.
It's easy to get involved and have your say.
Come on down to the Botany Night Markets - and meet our Local Board members and staff - have a chat and give your feedback on the draft plan.
Just go online to shapeauckland.co.nz to read the draft
Howick Local Board Plan and to make a submission.
Feedback accepted from 22 May to 30 June.",Local Board Plan - Botany Night Markets,event,https://www.facebook.com/events/1517539028287616/,42866.8022,16,0,0,15,0,1,0,0,0,48,1.4767E+14,Local,0,0,0,0,0,1,1
147669708631237_1451232401608288,"Auckland Transport has launched a new app which makes it easier to catch a bus, train or ferry.",New public transport app launched,link,http://ourauckland.aucklandcouncil.govt.nz/articles/news/2017/05/new-public-transport-app-launched/,42865.63057,8,0,0,8,0,0,0,0,0,24,1.4767E+14,Local,1,0,0,0,0,0,1
148215701964311_1294736357312234,"Today marks an important occasion for plant conservation! A new agreement has been signed between Department of Conservation and Botanic Gardens Australia and New Zealand (NZ) for working together, in partnership, on plant conservation. Bganz 

Pictured from left to right: Bec Stanley, (Auckland Botanic Gardens), Lou Sanson (DOC), Jack Hobbs (Auckland Botanic Gardens) and Hon Maggie Barry.",Timeline Photos,photo,https://www.facebook.com/aklbotanicgardens/photos/a.200032723449275.42946.148215701964311/1294736357312234/?type=3,42864.88509,39,1,4,38,0,1,0,0,0,123,1.48216E+14,Domain,1,0,0,0,0,0,1
1499637530318612_1918798058402555,Doing my bit to save ratepayers forking out on Council lunches ...,Timeline Photos,photo,https://www.facebook.com/gregsayersnz/photos/a.1499645970317768.1073741829.1499637530318612/1918798058402555/?type=3,42907.87425,35,2,2,34,0,0,1,0,0,111,1.49964E+15,Influencer,0,1,0,0,0,0,1
1499637530318612_1915982748684086,In attendanve at the Rodney Local Board meeting this week together  with the Deputy Mayor Bill Cashmore.,Timeline Photos,photo,https://www.facebook.com/gregsayersnz/photos/a.1499645970317768.1073741829.1499637530318612/1915982748684086/?type=3,42902.61354,0,0,0,0,0,0,0,0,0,0,1.49964E+15,Influencer,0,0,1,0,0,1,1
