status_id,status_message,link_name,status_type,status_link,status_published,num_reactions,num_comments,num_shares,num_likes,num_loves,num_wows,num_hahas,num_sads,num_angrys,impact_score,page_id,Source type,auckland ,council ,mayor ,goff,councillor,local board ,tier1
34497296301_10154506378461302,"An affordable property in the Auckland City area is virtually extinct - with no suburbs outside the apartment-rich areas now below a median value of $600,000.",'Affordable Auckland' a thing of the past,link,http://www.nzherald.co.nz/business/news/article.cfm?c_id=3&objectid=11865686,42890.57742,147,58,20,91,0,6,3,20,27,577,34497296301,Media,1,0,0,0,0,0,1
34497296301_10154503134581302,Students from an Auckland secondary school will have the choice to admit consumption or be tested.,Sniffer dog to check students at school ball,link,http://www.nzherald.co.nz/nz/news/article.cfm?c_id=1&objectid=11867672,42889.55494,926,162,36,734,9,34,131,4,14,3138,34497296301,Media,1,0,0,0,0,0,1
34497296301_10154501601356302,A mystery man who helped an elderly gentleman with a walking frame cross a busy South Auckland road is being hailed as a community hero on social media.,"""Wonderful, my heart melts when we see these gestures""",link,http://www.nzherald.co.nz/nz/news/article.cfm?c_id=1&objectid=11869054&ref=NZH_FBpage,42888.98398,21695,645,756,18514,3067,99,11,4,0,67131,34497296301,Media,1,0,0,0,0,0,1
34497296301_10154501401091302,"A sole America's Cup event in Auckland ""wouldn't work these days"".",Sir Russell Coutts: America's Cup in NZ wouldn't work,link,http://www.nzherald.co.nz/sport/news/article.cfm?c_id=4&objectid=11868979&ref=NZH_FBpage,42888.90212,93,82,5,57,4,2,14,0,16,448,34497296301,Media,1,0,0,0,0,0,1
34497296301_10154500689231302,"Auckland schools are taking desperate measures, even building houses, to recruit teachers.",School turns house-builder to lure staff,link,http://www.nzherald.co.nz/nz/news/article.cfm?c_id=1&objectid=11868150,42888.70903,163,36,53,124,2,25,9,2,1,614,34497296301,Media,1,0,0,0,0,0,1
34497296301_10154500380811302,An Auckland mum lost her husband and now faces a battle to save her daughter.,'Last Christmas Day they were both in hospital',link,http://www.nzherald.co.nz/nz/news/article.cfm?c_id=1&objectid=11867551,42888.5895,857,39,73,291,65,6,0,489,6,2722,34497296301,Media,1,0,0,0,0,0,1
34497296301_10154498808171302,An Auckland man has been jailed for his part in the largest ever seizure of P in New Zealand.,Meth importer jailed for 22 years,link,http://www.nzherald.co.nz/nz/news/article.cfm?c_id=1&objectid=11868395&ref=NZH_fb,42888.125,712,105,58,555,12,69,60,6,10,2404,34497296301,Media,1,0,0,0,0,0,1
34497296301_10154498967511302,#BREAKING A professional boxer has been jailed after leaving an Auckland sports coach to die in a pool of his own blood.,Details emerge of brutal attack: 'They posed no threat to you at all',link,http://www.nzherald.co.nz/nz/news/article.cfm?c_id=1&objectid=11868341&ref=NZH_fb,42888.08911,460,140,72,149,1,71,7,50,182,1732,34497296301,Media,1,0,0,0,0,0,1
34497296301_10154498724741302,An Auckland restaurant has been disciplined for failing to pay a staffer the minimum wage.,Former restaurant worker wins $40k,link,http://www.nzherald.co.nz/business/news/article.cfm?c_id=3&objectid=11868156&ref=NZH_fb,42888.05208,753,104,62,648,25,48,15,2,15,2529,34497296301,Media,1,0,0,0,0,0,1
34497296301_10154498545611302,A pair of bungling burglars have been caught red-handed thanks to a clever Auckland teenager.,Auckland burglars leave muddy trail,link,http://www.nzherald.co.nz/crime/news/article.cfm?c_id=30&objectid=11868143&ref=NZH_fb,42887.95525,542,72,75,348,2,7,122,3,60,1845,34497296301,Media,1,0,0,0,0,0,1
34497296301_10154518915151700,"Artist Edgar Mueller has revealed his latest experiment in perspective, with a new work opening in Auckland #NZHFocus",,video,https://www.facebook.com/nzherald.co.nz/videos/10154518915151700/,42887.87847,16,1,4,14,0,2,0,0,0,54,34497296301,Media,1,0,0,0,0,0,1
34497296301_10154497372781302,Otago Regional councillor Michael Laws' post on social media has raised some hackles.,'Right ... so gypsy is the new n*****?',link,http://www.nzherald.co.nz/nz/news/article.cfm?c_id=1&objectid=11868033,42887.60867,97,73,7,63,5,2,25,1,1,444,34497296301,Media,0,0,0,0,1,0,1
34497296301_10154497228571302,The birth of a baby helped Auckland Mayor Phil Goff pass his bed tax yesterday.,Birth of a baby helps Goff pass 'bed tax',link,http://www.nzherald.co.nz/nz/news/article.cfm?c_id=1&objectid=11867765,42887.56624,19,8,3,15,1,0,3,0,0,76,34497296301,Media,1,0,1,1,0,0,1
34497296301_10154516580106700,Auckland and Northland are going to be walloped by rain tomorrow  É??  bring your brolly!,,video,https://www.facebook.com/nzherald.co.nz/videos/10154516580106700/,42887.15972,468,334,82,346,3,45,6,54,14,2154,34497296301,Media,1,0,0,0,0,0,1
34497296301_10154495637621302,Auckland Airport has unveiled details of new transport projects to ease congestion.,Auckland Airport spending big to beat traffic woes,link,http://www.nzherald.co.nz/business/news/article.cfm?c_id=3&objectid=11867674,42887.07639,556,82,49,509,14,24,6,0,3,1881,34497296301,Media,1,0,0,0,0,0,1
34497296301_10154495489671302,A supercar that was crashed in Auckland while it was being taken for a test drive is being sold.,'Bargain' McLaren supercar going under the hammer,link,http://www.nzherald.co.nz/nz/news/article.cfm?c_id=1&objectid=11867661,42887.01572,869,385,150,575,5,90,187,11,1,3527,34497296301,Media,1,0,0,0,0,0,1
34497296301_10154495060676302,Black sludge flowing to the ocean from a stormwater outlet at an Auckland beach has caused panic.,Black sludge pours from drain on Auckland beach,link,http://www.nzherald.co.nz/nz/news/article.cfm?c_id=1&objectid=11867503,42886.87175,69,42,6,26,0,14,1,3,25,297,34497296301,Media,1,0,0,0,0,0,1
34497296301_10154494540481302,"If you're sick go to hospital for free, not the expensive after-hours clinic, urges one Auckland social agency.",Sick Kiwis should go straight to A&E,link,http://www.nzherald.co.nz/nz/news/article.cfm?c_id=1&objectid=11867276,42886.71522,853,242,125,627,16,22,4,10,174,3168,34497296301,Media,1,0,0,0,0,0,1
34497296301_10154493916106302,Renting in Auckland is tough enough...,"Would-be tenant faces strict rules about drugs, noise and parties because she's Brazilian",link,http://www.nzherald.co.nz/nz/news/article.cfm?c_id=1&objectid=11866739,42886.52764,125,54,11,64,1,6,11,11,32,494,34497296301,Media,1,0,0,0,0,0,1
34497296301_10154492705926302,Emirates is ditching its daily A380 superjumbo flight between Auckland and Sydney.,Emirates axes Auckland-Sydney superjumbo flight,link,http://www.nzherald.co.nz/business/news/article.cfm?c_id=3&objectid=11866931,42886.14583,467,184,48,264,3,57,8,125,10,1817,34497296301,Media,1,0,0,0,0,0,1
34497296301_10154513353741700,Horowhenua locals are taking on the District Council over a decision to sell off 115 pensioner houses É?? but it might be too late  #NZHFocus #NZonAir,,video,https://www.facebook.com/nzherald.co.nz/videos/10154513353741700/,42885.97917,40,8,7,18,0,4,0,1,17,143,34497296301,Media,0,1,0,0,0,0,1
34497296301_10154492451001302,#BREAKING Robbers escaped with cash as they threatened customers with guns at an Auckland bar.,SHOTS FIRED at Auckland bar,link,http://www.nzherald.co.nz/nz/news/article.cfm?c_id=1&objectid=11866876,42885.96278,334,90,100,152,2,77,4,14,85,1282,34497296301,Media,1,0,0,0,0,0,1
34497296301_10154492103521302,The British and Irish Lions arrive at Auckland Airport and are welcomed with a fierce pèçwhiri.,,video,https://www.facebook.com/nzherald.co.nz/videos/10154492103521302/,42885.8152,3619,685,890,2713,813,52,31,6,4,13117,34497296301,Media,1,0,0,0,0,0,1
34497296301_10154490328126302,Game of Thrones and Aquaman star Jason Momoa and the Auckland UFC crew perform a stirring Haka in support of Mark Hunt ahead of his fight against Derrick Lewis next month.,,video,https://www.facebook.com/nzherald.co.nz/videos/10154490328126302/,42885.19096,1134,120,212,984,118,29,3,0,0,3854,34497296301,Media,1,0,0,0,0,0,1
34497296301_10154490235911302,A 92-year-old West Auckland motorist who has been caught speeding 7 times in the past 5 months thinks he knows how to fix the issue.,Speedy granddad's message to the government,link,http://www.nzherald.co.nz/nz/news/article.cfm?c_id=1&objectid=11866124&ref=NZH_fb,42885.16667,740,121,96,538,10,24,161,2,5,2558,34497296301,Media,1,0,0,0,0,0,1
34497296301_10154489695191302,An Auckland woman has been caught red-handed climbing on the bonnet of a man's $518k McLaren. This is his message to her.,'WANTED: Who the hell knows this *****?',link,http://www.nzherald.co.nz/nz/news/article.cfm?c_id=1&objectid=11865908&ref=NZH_fb,42884.93933,1501,558,152,847,7,132,427,5,83,5771,34497296301,Media,1,0,0,0,0,0,1
34497296301_10154488623636302,Struggling Auckland families are moving north but suffering same problems.,Struggling Auckland families often worse off in Northland,link,http://www.nzherald.co.nz/business/news/article.cfm?c_id=3&objectid=11865657,42884.6067,50,40,13,37,0,6,0,6,1,243,34497296301,Media,1,0,0,0,0,0,1
34497296301_10154486977071302,Far North Deputy Mayor Tania McInnes talks us through Northland's impressive economic growth #NZHFocus,,video,https://www.facebook.com/nzherald.co.nz/videos/10154486977071302/,42884.07986,11,0,4,11,0,0,0,0,0,37,34497296301,Media,0,0,1,0,0,0,1
34497296301_10154486754886302,"Stuck in Auckland but craving the cuisine of Fiji, Samoa or Tonga? Look no further. (Via NZH Lifestyle)","Review | Kai Pasifika, Mt Eden",link,http://www.nzherald.co.nz/lifestyle/news/article.cfm?c_id=6&objectid=11865010&ref=NZH_fb,42883.93069,973,194,70,880,73,19,1,0,0,3377,34497296301,Media,1,0,0,0,0,0,1
34497296301_10154486529401302,Auckland is struggling to keep up with one part of New Zealand.,The region of New Zealand where everything's booming,link,http://www.nzherald.co.nz/business/news/article.cfm?c_id=3&objectid=11865463&ref=NZH_fb,42883.84861,252,45,47,239,6,5,0,2,0,893,34497296301,Media,1,0,0,0,0,0,1
34497296301_10154486314811302,"""I felt sick to my stomach when I walked into the councillors' room and saw a buffet meal, footed by the ratepayer, for us all to eat.""",Councillor wants colleagues to bring lunch or pay for catered food,link,http://www.nzherald.co.nz/nz/news/article.cfm?c_id=1&objectid=11865462&ref=NZH_fb,42883.75231,2494,296,229,1864,35,141,30,24,400,8303,34497296301,Media,0,0,0,0,1,0,1
34497296301_10154484345991302,Could you make it from Auckland Central to Manukau in under an hour just before 5pm?,The judge's challenge - beat rush hour to get to my court or be in contempt,link,http://www.nzherald.co.nz/nz/news/article.cfm?c_id=1&objectid=11864565,42883.09722,373,151,34,227,0,32,102,4,8,1455,34497296301,Media,1,0,0,0,0,0,1
34497296301_10154483524981302,"West Auckland crash victim ""had the biggest heart and was always the life of the party"".","Talented, young, 'good mum' killed in collision",link,http://www.nzherald.co.nz/nz/news/article.cfm?c_id=1&objectid=11864887,42882.78253,2880,121,194,1255,232,26,2,1362,3,9076,34497296301,Media,1,0,0,0,0,0,1
34497296301_10154481710461302,Watch: A king tide caused surface flooding on a waterfront road in Auckland tonight.,Tamaki Drive open after king tide flood,link,http://www.nzherald.co.nz/nz/news/article.cfm?c_id=1&objectid=11864665,42882.21997,400,50,47,291,1,98,10,0,0,1347,34497296301,Media,1,0,0,0,0,0,1
34497296301_10154481539626302,An Auckland man took nearly $1 million from his sickly mum's accounts.,High Court finds son took $1m from dying mum,link,http://www.nzherald.co.nz/nz/news/article.cfm?c_id=1&objectid=11864561,42882.13194,342,53,21,96,1,12,0,72,161,1153,34497296301,Media,1,0,0,0,0,0,1
34497296301_10154481414761302,A man was critically injured when he was impaled while attempting to climb a fence in South Auckland this afternoon.,Man impaled on fence at MIT,link,http://www.nzherald.co.nz/nz/news/article.cfm?c_id=1&objectid=11864638,42882.07138,188,87,13,105,0,29,49,5,0,751,34497296301,Media,1,0,0,0,0,0,1
34497296301_10154499036006700,Joanna Harris lost her baby in a horrific crash. She would have died too if Dr Marcus Chan had not been aboard the Auckland Rescue Helicopter #NZHFocus,,video,https://www.facebook.com/nzherald.co.nz/videos/10154499036006700/,42881.15625,225,6,8,141,28,2,0,54,0,695,34497296301,Media,1,0,0,0,0,0,1
34497296301_10154478599531302,The teen who stabbed West Auckland dairy worker Arun Kumar to death is back at school.,Dairy owner Arun Kumar's teenage killer paroled,link,http://www.nzherald.co.nz/nz/news/article.cfm?c_id=1&objectid=11864049&ref=NZH_fb,42881.07292,1903,516,149,325,2,214,9,93,1260,6890,34497296301,Media,1,0,0,0,0,0,1
34497296301_10154478494341302,"#BREAKING New Zealand Order of Merit holder, lawyer John Chadwick É?? the husband of Mayor Steve Chadwick É?? has died.",'This has come as a shock to everyone',link,http://www.nzherald.co.nz/nz/news/article.cfm?c_id=1&objectid=11864009&ref=NZH_fb,42880.98848,314,24,45,99,22,5,1,187,0,1035,34497296301,Media,0,0,1,0,0,0,1
34497296301_10154478293701302,Three people guilty of the attack of a 19 year old near Auckland will spend more than 12 years in jail.,"Kiwi woman kidnapped, attacked and sexually violated",link,http://www.nzherald.co.nz/nz/news/article.cfm?c_id=1&objectid=11863870,42880.89841,1014,241,81,684,12,16,110,23,169,3605,34497296301,Media,1,0,0,0,0,0,1
34497296301_10154478051706302,"An Auckland man who brutally beat his 69-year-old neighbour, then sexually assaulted her as she lay dying has been jailed for at least 17 years. 

How does his sentence compare?",New Zealand's longest prison sentences,link,http://www.nzherald.co.nz/nz/news/article.cfm?c_id=1&objectid=11857803&ref=NZH_FBpage,42880.80131,841,559,44,321,2,22,8,52,436,3685,34497296301,Media,1,0,0,0,0,0,1
34497296301_10154477947326302,A car smash in Auckland has left one person seriously injured this morning.,Person seriously injured after three-car smash in Auckland,link,http://www.nzherald.co.nz/nz/news/article.cfm?c_id=1&objectid=11863659&ref=NZH_FBpage,42880.78815,34,1,1,29,0,2,0,3,0,105,34497296301,Media,1,0,0,0,0,0,1
34497296301_10154477816626302,"#BREAKING An Auckland man who brutally beat his 69-year-old neighbour, then sexually assaulted her as she lay dying, has made one last chilling comment about his crimes in court.",Jaden Stroobant jailed for life for the murder of Te Atatu woman Cunxiu Tian - National - NZ Herald News,link,http://www.nzherald.co.nz/nz/news/article.cfm?c_id=1&objectid=11862764,42880.75088,3423,1526,322,829,5,66,6,358,2159,13643,34497296301,Media,1,0,0,0,0,0,1
34497296301_10154477117641302,An average Auckland family says the Budget's tax tweaks do nothing to help them get ahead.,Family look to leave NZ despite tax cut,link,http://www.nzherald.co.nz/business/news/article.cfm?c_id=3&objectid=11863232,42880.53531,610,345,43,487,10,12,68,23,10,2563,34497296301,Media,1,0,0,0,0,0,1
34497296301_10154476052236302,A man jailed for life as a teenager for murdering a police officer allegedly tried to escape from Auckland Prison.,Cop killer's escape from Auckland Prison foiled after he was found in roof with contraband,link,http://www.nzherald.co.nz/nz/news/article.cfm?c_id=1&objectid=11863072&ref=NZH_FBpage,42880.13435,143,57,36,107,4,7,13,0,12,579,34497296301,Media,1,0,0,0,0,0,1
34497296301_10154475990306302,#BREAKING A celebrity Auckland hairdresser facing cocaine charges has lost name suppression.,Celebrity cocaine sting: High-flyer appears in court,link,http://www.nzherald.co.nz/nz/news/article.cfm?c_id=1&objectid=11863268&ref=NZH_fb,42880.09888,293,103,28,208,3,14,61,4,3,1113,34497296301,Media,1,0,0,0,0,0,1
34497296301_10154475085126302,Kelly Peteru captured this incredible shot of fog blanketing Auckland this morning.,Timeline Photos,photo,https://www.facebook.com/nzherald.co.nz/photos/a.176893216301.135996.34497296301/10154475085126302/?type=3,42879.76505,1855,31,76,1642,104,109,0,0,0,5703,34497296301,Media,1,0,0,0,0,0,1
34497296301_10154474843956302,An Auckland Indian restaurant is doing its bit to help people in need.,'Free food for people in need': Indian restaurant praised for generosity,link,http://www.nzherald.co.nz/spotlight/news/article.cfm?c_id=1504095&objectid=11862798,42879.69903,10035,499,847,8535,1383,112,2,1,2,31950,34497296301,Media,1,0,0,0,0,0,1
34497296301_10154474693376302,Thick fog is shrouding Auckland this morning causing travel chaos as flights are cancelled and dozens delayed.,"Heavy fog blankets Auckland, flights cancelled",link,http://www.nzherald.co.nz/nz/news/article.cfm?c_id=1&objectid=11862727,42879.649,74,16,13,57,0,16,0,1,0,267,34497296301,Media,1,0,0,0,0,0,1
34497296301_10154474479176302,"If you find moving house daunting, imagine shifting 1200 staff from five Auckland separate sites to new premises.",Datacom move is NZ's biggest shift,link,http://www.nzherald.co.nz/business/news/article.cfm?c_id=3&objectid=11861492,42879.58275,203,40,20,191,5,2,4,1,0,709,34497296301,Media,1,0,0,0,0,0,1
34497296301_10154474328081302,Thick fog is shrouding Auckland this morning causing travel chaos as flights are cancelled and dozens delayed.,Heavy fog blankets Auckland,link,http://www.nzherald.co.nz/nz/news/article.cfm?c_id=1&objectid=11862727,42879.53365,147,29,27,114,3,27,1,1,1,526,34497296301,Media,1,0,0,0,0,0,1
34497296301_10154474303406302,Joanna Harris' body was broken in a horrific crash that killed her unborn baby. It would have killed her too if Dr Marcus Chan had not been aboard the Auckland Rescue Helicopter.,Crash victim meets doctor who saved her life,link,http://www.nzherald.co.nz/nz/news/article.cfm?c_id=1&objectid=11862535,42879.52354,788,35,30,623,117,28,0,20,0,2464,34497296301,Media,1,0,0,0,0,0,1
34497296301_10154473381406302,One man's distaste for venison sparks ire of Auckland restaurateurs.,Restaurant critics 'trespassed' from Auckland eatery,link,http://www.nzherald.co.nz/nz/news/article.cfm?c_id=1&objectid=11862305&ref=NZH_FBpage,42879.18911,75,27,6,63,0,0,11,1,0,285,34497296301,Media,1,0,0,0,0,0,1
34497296301_10154494179736700,There were emotional scenes in the public gallery as the Horowhenua District Council voted to sell off 115 pensioner houses across the region #NZHFocus #NZonAir,,video,https://www.facebook.com/nzherald.co.nz/videos/10154494179736700/,42879.1875,892,171,333,203,3,55,1,169,461,3351,34497296301,Media,0,1,0,0,0,0,1
34497296301_10154471834776302,"Owners of a big Auckland residential complex are facing a potential $32.8 million bill to fix leaky, fire, roof, structural and even methamphetamine issues - one of New Zealand's biggest repairs of its kind.",Apartment owners face $32.8m repair,link,http://www.nzherald.co.nz/business/news/article.cfm?c_id=3&objectid=11860915,42878.60979,187,77,40,108,0,44,24,8,3,755,34497296301,Media,1,0,0,0,0,0,1
34497296301_10154470391366302,"The disgraced fraudster and former CEO of Auckland business group Heart of the City, has opened up about his time behind bars.",'Inmates assumed I was a sex offender',link,http://www.nzherald.co.nz/business/news/article.cfm?c_id=3&objectid=11861467&ref=NZH_Tw,42878.20833,79,33,2,42,1,1,28,0,7,305,34497296301,Media,1,0,0,0,0,0,1
34497296301_10154470549256302,The audacious Auckland art heist where ram-raiders stole two rare paintings last month was more sophisticated than police have let on.,Lindauer heist: Raid details revealed,link,http://www.nzherald.co.nz/nz/news/article.cfm?c_id=1&objectid=11861689&ref=NZH_FBpage,42878.18264,53,6,10,43,1,7,0,2,0,181,34497296301,Media,1,0,0,0,0,0,1
34497296301_10154470377546302,An Auckland boatshed with gorgeous sea views has an asking price well above the nationwide average É?? for a house.,"Historic shed for sale, boats only",link,http://www.nzherald.co.nz/business/news/article.cfm?c_id=3&objectid=11861444&ref=NZH_fb,42878.10417,57,20,8,35,0,8,11,0,3,219,34497296301,Media,1,0,0,0,0,0,1
34497296301_10154469088976302,An Auckland man managed to pick up his KFC using a drone.,Chicken wings really do fly: Auckland man collects KFC using drone,link,http://www.nzherald.co.nz/business/news/article.cfm?c_id=3&objectid=11860941,42877.63302,106,47,16,74,2,7,23,0,0,428,34497296301,Media,1,0,0,0,0,0,1
34497296301_10154467853196302,Residents of an upmarket Auckland suburb are the latest to launch a fight over plans for a high-density development on their doorstep.,Twice as many houses on half the land,link,http://www.nzherald.co.nz/business/news/article.cfm?c_id=3&objectid=11860921,42877.18595,126,82,15,74,3,5,26,1,17,557,34497296301,Media,1,0,0,0,0,0,1
34497296301_10154488663721700,An Auckland man will attempt over 151 bungy jumps in 24 hours tomorrow to raise funds for mental health causes #NZHFocus,,video,https://www.facebook.com/nzherald.co.nz/videos/10154488663721700/,42877.10417,386,18,48,322,34,27,3,0,0,1242,34497296301,Media,1,0,0,0,0,0,1
34497296301_10154467393751302,Concerned Auckland parents are sending their children to learn MMA after series of abduction scares across the city.,,video,https://www.facebook.com/nzherald.co.nz/videos/10154467393751302/,42876.99008,262,35,75,235,24,3,0,0,0,931,34497296301,Media,1,0,0,0,0,0,1
34497296301_10154467334561302,"Up to 50,000 Auckland residents have received breast screening appointment reminders by mistake.",Mammogram reminders mistakenly sent,link,http://www.nzherald.co.nz/nz/news/article.cfm?c_id=1&objectid=11860940&ref=NZH_fb,42876.95811,20,31,4,11,1,2,6,0,0,126,34497296301,Media,1,0,0,0,0,0,1
34497296301_10154466875671302,#BREAKING Major delays at Auckland Airport have been reported due to Immigration NZ's national system going down.,Major airport check-in delays after computer crash,link,http://www.nzherald.co.nz/business/news/article.cfm?c_id=3&objectid=11860878,42876.80654,143,48,37,99,1,21,17,5,0,562,34497296301,Media,1,0,0,0,0,0,1
34497296301_10154466089691302,Auckland Transport has warned commuters to expect delays and cancellations on the Southern Line after a person was killed in Manurewa.,Person killed after hit by train in South Auckland,link,http://www.nzherald.co.nz/nz/news/article.cfm?c_id=1&objectid=11860711,42876.58056,909,225,230,400,3,184,2,314,6,3407,34497296301,Media,1,0,0,0,0,0,1
34497296301_10154464261956302,A spat has broken out between two Auckland restaurant owners after one dined at the other's bistro and reportedly failed to pay his bill.,Eatery owners fight over unpaid bill,link,http://www.nzherald.co.nz/business/news/article.cfm?c_id=3&objectid=11860377,42875.87332,170,77,6,109,1,12,44,1,3,670,34497296301,Media,1,0,0,0,0,0,1
34497296301_10154463707066302,"Corrections is installing a dialysis machine in Auckland Prison, Paremoremo, for life-extending treatment for convicted drug operation mastermind William ""Bird"" Hines.",Drug 'kingpin' to get dialysis in jail,link,http://www.nzherald.co.nz/nz/news/article.cfm?c_id=1&objectid=11859850,42875.68374,1019,458,150,619,24,57,23,15,281,4123,34497296301,Media,1,0,0,0,0,0,1
34497296301_10154461441041302,An Auckland daredevil is on a mission to crack a world record for the most bungy jumps in 24 hours - all while fundraising for mental health causes.,Bungy lover to set world record,link,http://www.nzherald.co.nz/nz/news/article.cfm?c_id=1&objectid=11858515,42874.86111,98,7,9,89,7,2,0,0,0,317,34497296301,Media,1,0,0,0,0,0,1
34497296301_10154459588066302,A man crushed between two cars in Auckland this week had been rushing to buy tickets to the Wiggles for his family.,Man crushed in dash for Wiggles tickets,link,http://www.nzherald.co.nz/nz/news/article.cfm?c_id=1&objectid=11859158,42874.18899,471,81,29,168,3,51,13,236,0,1604,34497296301,Media,1,0,0,0,0,0,1
34497296301_10154459514196302,The fire service has warned the dramatic blaze in an Auckland high rise could have been much worse.,Skyscraper fire: 'We dodged a bullet',link,http://www.nzherald.co.nz/nz/news/article.cfm?c_id=1&objectid=11859360&ref=NZH_fb,42874.1475,95,6,3,86,0,5,0,2,2,300,34497296301,Media,1,0,0,0,0,0,1
34497296301_10154459049921302,"The man who died while swimming on Auckland's North Shore was a popular, 'extraordinary' University of Auckland academic.",Nicholas Tarling mourned: 'He died doing something he loved',link,http://www.nzherald.co.nz/nz/news/article.cfm?c_id=1&objectid=11859176&ref=NZH_fb,42874.08333,83,12,14,42,4,0,0,37,0,287,34497296301,Media,1,0,0,0,0,0,1
34497296301_10154459132011302,#BREAKING Police may review the case of a 15-year-old who died after being punched repeatedly at a West Auckland rugby field.,Death of a schoolboy: Police may review case after Coroner's findings,link,http://www.nzherald.co.nz/nz/news/article.cfm?c_id=1&objectid=11859281&ref=NZH_fb,42873.96983,188,30,19,124,3,0,0,41,20,643,34497296301,Media,1,0,0,0,0,0,1
34497296301_10154456128671302,#BREAKING An Auckland man who secretly recorded women undressing and couples having sex has been jailed.,'Grey Lynn peeping Tom' jailed,link,http://www.nzherald.co.nz/nz/news/article.cfm?c_id=1&objectid=11858388&ref=NZH_fb,42872.86131,194,139,28,118,1,6,35,1,33,888,34497296301,Media,1,0,0,0,0,0,1
34497296301_10154475255461700,Apartments with not a single car park É?? welcome to the new Auckland #NZHFocus,,video,https://www.facebook.com/nzherald.co.nz/videos/10154475255461700/,42872.09722,75,54,2,38,2,3,14,1,17,335,34497296301,Media,1,0,0,0,0,0,1
34497296301_10154453929016302,The driver of a McLaren super car which crashed on an Auckland motorway can now be named.,Meet the man who crashed supercar in Auckland,link,http://www.nzherald.co.nz/nz/news/article.cfm?c_id=1&objectid=11857631,42872.08598,480,178,65,331,1,33,96,17,2,1861,34497296301,Media,1,0,0,0,0,0,1
