status_id,status_message,link_name,status_type,status_link,status_published,num_reactions,num_comments,num_shares,num_likes,num_loves,num_wows,num_hahas,num_sads,num_angrys,impact_score,page_id,Source type,auckland ,council ,mayor ,goff,councillor,local board ,tier1
190318854322360_1481174751903424,"Would you like to win a Takapuna experience for two including one night stay at the Spencer on Byron and brunch at Zomer Caf«∏ courtesy of ilovetakapuna.co.nz? 

Simply go to shapeauckland.co.nz and provide feedback to our new draft 2017 Devonport-Takapuna Local Board Plan before 30 June.",Help Shape Devonport-Takapuna,link,http://www.shapeauckland.co.nz/consultations/draft-devonport-takapuna-local-board-plan-2017/,42897.96944,5,1,1,5,0,0,0,0,0,18,1.90319E+14,Local,0,0,0,0,0,1,1
190318854322360_1499997143354518,"A couple of snaps from Local Board Member  Jennifer McKenzie - Devonport Takapuna Local Board Member following our Engagement Session at Allen Hill Stadium last Saturday! It was really great hearing from our community - your feedback is valued! 

We have one more event coming up this Sunday at the Takapuna Sunday Market - so come grab a coffee and have a chat to our Local Board Members and staff who are all keen to hear what you have to say! 

If you can't make it this Sunday, you can still submit your feedback online at www.shapeauckland.co.nz",Jennifer McKenzie - Devonport Takapuna Local Board Member,photo,https://www.facebook.com/JenniferMcKenzieBoardMember/photos/a.1716111671983844.1073741832.1710076149254063/1837078576553819/?type=3,42897.86669,6,0,0,6,0,0,0,0,0,18,1.90319E+14,Local,0,0,0,0,0,1,1
190318854322360_1496662427021323,"Share your views on how to reduce congestion on Lake Road with your local board and Auckland Transport.
AT is holding information sessions on proposed improvements to Lake Road this weekend.
É?ΩTomorrow, June 10, from 8am to 11am - Allen Hill Stadium (Dacre Park), Lake Road, Devonport.
É?ΩSunday, June 11, from 10am to 2pm - Devonport Craft & Fine Food Market, 32 Clarence Street, Devonport.
Click on the link below and find out ways to provide feedback:",Have your say on Lake Road improvements,link,http://ourauckland.aucklandcouncil.govt.nz/articles/news/2017/05/have-your-say-on-lake-road-improvements/,42895.0625,6,1,3,6,0,0,0,0,0,23,1.90319E+14,Local,1,0,0,0,0,1,1
190318854322360_1495107520510147,"A couple of snaps from the Devonport-Takapuna Local Board engagement session at Sunnynook Community Centre.

Special thanks to Target Road School for your awesome submission, as well Wairau Intermediate School, Community Constable Penny Rusbatch and members of the public that came to see us and taking the time to have your say!

We have two more drop in engagement sessions, where we invite you to come share your views and ideas with our team

- 10th June É?? Allen Hill Stadium É?? 8am É?? 11am 
- 18th June É?? Takapuna Sunday Market É?? 8am É?? 1pm

If you can't make these informal sessions you are still welcome to submit online by visiting  www.shapeauckland.co.nz",Photos from Devonport-Takapuna Local Board's post,photo,https://www.facebook.com/devonporttakapuna/photos/a.216735078347404.52311.190318854322360/1495101427177423/?type=3,42893.69538,3,0,2,3,0,0,0,0,0,11,1.90319E+14,Local,0,0,0,0,0,1,1
190318854322360_1480300498657516,"Come talk with us about our new draft 2017 Devonport-Takapuna Local Board Plan.

If you see us at one of the below locations, please come chat to us so we can gain your views on some of the proposed initiatives that could matter to you.

É?Ω Sat 10 June, 8am-11am at Allen Hill Stadium in Devonport
É?Ω Sun 18 June, 8am-1pm at Takapuna Sunday Markets",Timeline Photos,photo,https://www.facebook.com/devonporttakapuna/photos/a.216735078347404.52311.190318854322360/1480300498657516/?type=3,42893.05694,5,2,3,4,1,0,0,0,0,22,1.90319E+14,Local,0,0,0,0,0,1,1
190318854322360_1480504928637073,"Would having more bike racks and scooter parking at our bus stations and ferry terminals support you to utilise public transport more? 

Tell us if you support this idea along with other proposed initiatives outlined in our new draft 2017 Devonport-Takapuna Local Board Plan at www.shapeauckland.co.nz before 30 June.",Shape Auckland,link,http://www.shapeauckland.co.nz/,42891.97917,2,0,0,2,0,0,0,0,0,6,1.90319E+14,Local,0,0,0,0,0,1,1
190318854322360_1480516535302579,"What do you think about having more outdoor group fitness equipment in our parks and reserves? 

Tell us if you support this idea along with other proposed initiatives outlined in our new draft 2017 Devonport-Takapuna Local Board Plan at www.shapeauckland.co.nz before 30 June.",Shape Auckland,link,http://www.shapeauckland.co.nz/,42891.01319,1,0,0,1,0,0,0,0,0,3,1.90319E+14,Local,0,0,0,0,0,1,1
190318854322360_1487000034654229,"There's lots of cool stuff going on for young people in the Devonport-Takapuna area and we want you to help us do more.
What do we need, what are we doing right and what can we do better? Make your voice heard in one of the following ways:

# Visit www.shapeauckland.co.nz to fill out submission form
# Write something on our Facebook page and include the 
words 'Local Board Plan feedback'
# send a private message include 'Local Board Plan feedback'.",,video,https://www.facebook.com/devonporttakapuna/videos/1487000034654229/,42887.08958,5,0,0,5,0,0,0,0,0,15,1.90319E+14,Local,0,0,0,0,0,1,1
190318854322360_1484053631615536,"What do you think the solutions are for a less congested Lake Road?

Go to shapeauckland.co.nz to give feedback on this and other ideas contained in our draft 2017 Devonport-Takapuna Local Board Plan. Feedback closes 30 June.",Help Shape Devonport-Takapuna,link,http://shapeauckland.co.nz/consultations/draft-devonport-takapuna-local-board-plan-2017/,42886.58611,3,0,2,3,0,0,0,0,0,11,1.90319E+14,Local,0,0,0,0,0,1,1
190318854322360_1480507488636817,"What do you think about the idea of developing heritage trails in Devonport, Milford and Takapuna? 

Go to shapeauckland.co.nz to give feedback on this and many ideas in the new draft 2017 Devonport-Takapuna Local Board Plan before 30 June.",Shape Auckland,link,http://www.shapeauckland.co.nz/,42885.98056,0,0,0,0,0,0,0,0,0,0,1.90319E+14,Local,0,0,0,0,0,1,1
190318854322360_1480496251971274,"Would you like to see more public art in our town centres, villages and parks? 

Tell us if you support this idea along with many other proposed initiatives outlined in our new draft 2017 Devonport-Takapuna Local Board Plan at www.shapeauckland.co.nz before 30 June.",Shape Auckland,link,http://www.shapeauckland.co.nz/,42884.59444,2,1,0,2,0,0,0,0,0,8,1.90319E+14,Local,0,0,0,0,0,1,1
190318854322360_1480503998637166,"Would having more bike racks and scooter parking at our bus stations and ferry terminals support you to utilise public transport more? 

Tell us if you support this idea along with other proposed initiatives outlined in our new draft 2017 Devonport-Takapuna Local Board Plan at www.shapeauckland.co.nz before 30 June.",Shape Auckland,link,http://www.shapeauckland.co.nz/,42883.60347,0,0,0,0,0,0,0,0,0,0,1.90319E+14,Local,0,0,0,0,0,1,1
190318854322360_1481283671892532,"Should we create a dog park in our area? 

Go to shapeauckland.co.nz to give feedback on this and other ideas contained in our draft 2017 Devonport-Takapuna Local Board Plan. Feedback closes 30 June.",Shape Auckland,link,http://www.shapeauckland.co.nz/,42882.66597,2,0,0,2,0,0,0,0,0,6,1.90319E+14,Local,0,0,0,0,0,1,1
190318854322360_1480515225302710,"Would you like us to invest in a plan to make Belmont town centre more vibrant and attractive? 

Tell us if you support this idea along with other proposed initiatives outlined in our new draft 2017 Devonport-Takapuna Local Board Plan at shapeauckland.co.nz before 30 June.",Shape Auckland,link,http://www.shapeauckland.co.nz/,42882.03264,0,0,0,0,0,0,0,0,0,0,1.90319E+14,Local,0,0,0,0,0,1,1
190318854322360_1481166421904257,"Would you like to win a Takapuna experience for two including one night stay at the Spencer on Byron and brunch at Zomer Caf«∏ courtesy of ilovetakapuna.co.nz? 

Simply go to shapeauckland.co.nz and provide feedback to our new draft 2017 Devonport-Takapuna Local Board Plan before 30 June.",Help Shape Devonport-Takapuna,link,http://www.shapeauckland.co.nz/consultations/draft-devonport-takapuna-local-board-plan-2017/,42880.78729,3,0,1,3,0,0,0,0,0,10,1.90319E+14,Local,0,0,0,0,0,1,1
190318854322360_1480301151990784,"Come talk with us about our new draft 2017 Devonport-Takapuna Local Board Plan.

Find out about some of our proposed initiatives that could matter to you.

É?Ω Sat 10 June, 8am-11am at Allen Hill Stadium in Devonport
É?Ω Sun 18 June, 8am-1pm at Takapuna Sunday Markets

Find out more, read the plan and provide feedback on it at www.shapeauckland.co.nz by 30 June.",Timeline Photos,photo,https://www.facebook.com/devonporttakapuna/photos/a.216735078347404.52311.190318854322360/1480301151990784/?type=3,42880.60278,1,0,0,1,0,0,0,0,0,3,1.90319E+14,Local,0,0,0,0,0,1,1
190318854322360_1480496078637958,"Would you like to see more public art in our town centres, villages and parks? 

Tell us if you support this idea along with many other proposed initiatives outlined in our new draft 2017 Devonport-Takapuna Local Board Plan at shapeauckland.co.nz before 30 June.",Shape Auckland,link,http://www.shapeauckland.co.nz/,42880.08686,4,0,0,4,0,0,0,0,0,12,1.90319E+14,Local,0,0,0,0,0,1,1
190318854322360_1480297891991110,"We're going to be out and about over the next month talking to local residents about our new draft 2017 Devonport-Takapuna Local Board Plan. 

If you see us, please chat to us so we can gain your views on some of the proposed initiatives that could matter to you. 

É?Ω Sat 10 June, 8am-11am at Allen Hill Stadium in Devonport
É?Ω Sun 18 June, 8am-1pm at Takapuna Sunday Markets",Timeline Photos,photo,https://www.facebook.com/devonporttakapuna/photos/a.216735078347404.52311.190318854322360/1480297891991110/?type=3,42879.83792,1,0,2,0,1,0,0,0,0,5,1.90319E+14,Local,0,0,0,0,0,1,1
190318854322360_1478317625522470,"If you're a Baywater ferry user, what do you think?

Have your say on this local board priority and many others now at shapeauckland.co.nz. Submissions close 30 June.",$12.5M upgrade sought for 'worst' ferry terminal on Auckland's North Shore,link,http://www.stuff.co.nz/auckland/local-news/north-shore-times/92669052/125m-upgrade-sought-for-worst-ferry-terminal-on-aucklands-north-shore,42877.74468,2,0,0,2,0,0,0,0,0,6,1.90319E+14,Local,0,0,0,0,0,1,1
190318854322360_1477527472268152,"We need your help - help to create the best community plan in all of Auckland. One that makes living in our local board area as good as it can be for as many of us as possible.

You will (if you haven't already) soon receive a household summary version of our new draft 2017 Devonport-Takapuna Local Board Plan in your letterbox. It will be a document featuring these kids walking along Castor Bay beach on it.

Please take the time to read over it, and the below story, and provide us your thoughts and feedback by 4pm, 30 June.",Help shape the future of your local area,link,http://ourauckland.aucklandcouncil.govt.nz/articles/news/2017/05/help-shape-the-future-of-your-local-area/,42876.8878,3,0,0,3,0,0,0,0,0,9,1.90319E+14,Local,0,0,0,0,0,1,1
190318854322360_1471297196224513,"We want your feedback on Easter Sunday trading in Auckland

Auckland Council wants to know what people that live and work in the Auckland region think about changing shop trading rules to allow more businesses to open on Easter Sunday. 

A recent law change means Auckland Council can decide whether to allow more shops to open on Easter Sunday. 

The council's Governing Body has decided to ask Aucklanders whether they want the council to leave things as they are or create a policy to allow more shops to open. 

Currently, only some shops, like service stations, dairies, pharmacies and food outlets, are allowed to open on Easter Sunday. Supermarkets and general retailers must remain closed. 

Visit shapeauckland.co.nz to have your say. Feedback closes at 4pm on Sunday 11 June.",About,link,http://shapeauckland.co.nz/consultations/easter-sunday-trading-tell-us-what-you-think/,42870.74693,3,0,0,3,0,0,0,0,0,9,1.90319E+14,Local,1,1,0,0,0,0,1
190318854322360_1471225486231684,"Many of the great things happening in your community are a result of your ideas and input, so we encourage you to have your say!! 

Every three years each local board develops a Local Board Plan, which helps to guide decisions on local activities and projects.

Plans reflect your community's priorities and preferences; they guide the regional strategies and plans of Auckland Council, and influence how we work with others for the benefit of our communities.

Devonport-Takapuna Local Board will be asking for your feedback about plans for your local community from Monday 22 May to  Friday 30 June, 2017

By sharing your feedback you'll be involved in:

- Helping shape the future of your local area
- Ensuring Local Board Plans reflect your community's preferences
helping us understand what you value most, so we prioritize what we deliver.

You can share your feedback on Shape Auckland or keep an eye out for details in your letterbox. http://www.shapeauckland.co.nz/  

Full draft plans will also be available at libraries, service centres and local board offices.

Devonport-Takapuna Local Board have also planned drop in sessions and we invite you to come and speak to us face to face: 

Thursday 25 May 2017 
11am-1pm
Sunnynook Community Centre, 148 Sycamore Dr, Sunnynook

Saturday 10 June 2017
8am-11am
Allen Hill Stadium, 25A Lake Road, Devonport

Sunday 18 June 2017
8am-1pm
Takapuna Sunday Market, 17 Anzac St, Takapuna.",Timeline Photos,photo,https://www.facebook.com/devonporttakapuna/photos/a.216735078347404.52311.190318854322360/1471225486231684/?type=3,42870.72466,2,0,2,2,0,0,0,0,0,8,1.90319E+14,Local,1,0,0,0,0,1,1
190318854322360_1465982493422650,Applications for the 2018 Auckland Council graduate programme are now open and we are searching for graduates who are passionate about shaping Auckland.,We're looking for talented graduates to join us!,link,http://ourauckland.aucklandcouncil.govt.nz/articles/news/2017/05/applications-for-our-graduate-programme-are-now-open/,42865.7485,2,0,0,2,0,0,0,0,0,6,1.90319E+14,Local,1,1,0,0,0,0,1
193815433990782_1435883393117307,On Sunday 9 July Queens Wharf will be closed to the public to pack down the Auckland Fanzone. Please note there will be no access to see The Lighthouse by Michael Parekèçwhai on this day.,Timeline Photos,photo,https://www.facebook.com/PublicArtAKL/photos/a.194090840629908.39349.193815433990782/1435883393117307/?type=3,42914.94238,3,0,0,3,0,0,0,0,0,9,1.93815E+14,Domain,1,0,0,0,0,0,1
193815433990782_1429453820426931,"Two new artworks by Seung Yul Oh have been unveiled at Albany Stadium Pool, Upon a Pond and Drop a Loop. If you're in the Upper Harbour Local Board area, be sure to visit these beautiful works.",Upon a Pond and Drop a Loop,video,https://www.facebook.com/PublicArtAKL/videos/1429453820426931/,42908.98712,36,3,18,31,5,0,0,0,0,132,1.93815E+14,Domain,0,0,0,0,0,1,1
193815433990782_1425464794159167,"Two new artworks by Seung Yul Oh were unveiled at Albany Stadium Pool on Saturday, Upon a Pond and Drop a Loop. If you're in the area, be sure to visit these beautiful works in the Upper Harbour Local Board area.",Photos from Public Art in Auckland's post,photo,https://www.facebook.com/PublicArtAKL/photos/a.194090840629908.39349.193815433990782/1425462530826060/?type=3,42904.77762,50,4,5,50,0,0,0,0,0,163,1.93815E+14,Domain,0,0,0,0,0,1,1
193815433990782_1419332178105762,"The Upper Harbour Local Board would like to invite you to the opening of the Upon a Pond and Drop a Loop artworks, at the newly built Albany Stadium Pool. Artist Seung Yul Oh will be in attendance and a short ceremony will be followed by light refreshments. 9.45am this Saturday 17 June. We hope to see you there.",Timeline Photos,photo,https://www.facebook.com/PublicArtAKL/photos/a.194090840629908.39349.193815433990782/1419332178105762/?type=3,42898.76684,34,2,11,32,2,0,0,0,0,117,1.93815E+14,Domain,0,0,0,0,0,1,1
200339767034713_363154977419857,"There are still plenty of Out and About events happening as we head into winter! Weekly Park Sport sessions at various locations along with Park Fun Days, Prams and Pathways Walks and our Doggy Day Out Walks! Check out when we are next near you by clicking here-http://ourauckland.aucklandcouncil.govt.nz/tags/?id=18573
Franklin Local Board Howick Local Board Manurewa Local Board Mangere-Otahuhu Local Board Otara-Papatoetoe Local Board Papakura Local Board",Tags,link,http://ourauckland.aucklandcouncil.govt.nz/tags/?id=18573,42863.84005,0,0,0,0,0,0,0,0,0,0,2.0034E+14,Domain,0,0,0,0,0,1,1
200372513310560_1684048738276256,"You don't need to fly to London to see these famous artworks; save the airfares and come along to the Auckland Art Gallery! The Body Laid Bare exhibition brings together more than 100 amazing works from the last two centuries; and we have 3 double passes to give away! Tell us why you want to go to be in to win! (Perhaps you could take your mum, seeing as it is Mother's Day!) aut.ac/2ocTpH1",Timeline Photos,photo,https://www.facebook.com/autuni/photos/a.203402766340868.60037.200372513310560/1684048738276256/?type=3,42862.97917,18,5,1,17,0,1,0,0,0,65,2.00373E+14,Domain,1,0,0,0,0,0,1
201812239843265_1651362821554859,Auckland Botanic Gardens is the proud recipient of a Qualmark gold sustainable tourism business award.,Blooming marvellous! Auckland Botanic Gardens scores top award,link,http://ourauckland.aucklandcouncil.govt.nz/articles/news/2017/06/blooming-marvellous-auckland-botanic-gardens-scoops-top-award/,42911.8591,34,3,4,29,3,2,0,0,0,112,2.01812E+14,Local,1,0,0,0,0,0,1
201812239843265_1646893065335168,"Congratulations to Damian Piilua, a longstanding member of the Manurewa Youth Council,  who is representing the Manurewa Local Board area on the Auckland Council Youth Advisory Panel.",Young Aucklanders step up,link,http://ourauckland.aucklandcouncil.govt.nz/articles/news/2017/06/young-aucklanders-step-up/,42911.625,10,2,1,9,1,0,0,0,0,35,2.01812E+14,Local,1,1,0,0,0,1,1
201812239843265_1647823665242108,"One week left to have your say! 
Now's the time to be heard. Whether you care about local community events, parks and playgrounds, or a town centre to be proud of, we want to hear from you.
Visit www.shapeauckland.co.nz to submit your feedback, or share your thoughts below, including the phrase ""Local Board Plan Feedback"" in your post. Submissions close Friday 30 June.",Shape Auckland,link,http://www.shapeauckland.co.nz/,42908.82192,69,22,13,66,3,0,0,0,0,264,2.01812E+14,Local,0,0,0,0,0,1,1
201812239843265_1646795135344961,"How can we make Manurewa an even better place to live? Help shape the future of Manurewa and have your say on the draft local board plan. 
visit www.shapeauckland.co.nz to make a submission or post your feedback below , with the phrase ""Local Board Plan Feedback"" in your comment.",,video,https://www.facebook.com/ManurewaLB/videos/1646795135344961/,42907.90726,70,13,25,69,0,0,0,1,0,261,2.01812E+14,Local,0,0,0,0,0,1,1
201812239843265_1642525835771891,"We need to know what matters to you and your whanau. Whether it's safer streets, or more youth employment training programmes. It's easy to have your say on the draft Manurewa Local Board Plan. Simply post your thoughts below using the words ""Local Board Plan Feedback"" in your comment, or visit www.shapeauckland.co.nz to make a submission.
Help us shape our community for our people.",Timeline Photos,photo,https://www.facebook.com/ManurewaLB/photos/a.272168389474316.77762.201812239843265/1642525835771891/?type=3,42904.65869,196,37,27,189,7,0,0,0,0,689,2.01812E+14,Local,0,0,0,0,0,1,1
201812239843265_1638895536134921,Our chair Angela Dalton and local board member Simeon Brown were recently at Gallagher Park got to see the work the Manukau Beautification Charitable  Trust is doing to rid our community of graffiti,Getting tough on graffiti,link,http://ourauckland.aucklandcouncil.govt.nz/articles/news/2017/06/getting-tough-on-graffiti/,42902.66667,14,0,1,13,1,0,0,0,0,43,2.01812E+14,Local,0,0,0,0,0,1,1
201812239843265_1637184346306040,"Are you proud to call Manurewa home? It's time to make your voice heard, and have your say on the draft Manurewa Local Board Plan.  
You can post your feedback below, simply use the phrase ""Local Board Plan feedback"" in your comment, or visit www.shapeauckland.co.nz by 30 June.",Manurewa - it's my home,video,https://youtu.be/kPmq7VhW3Ec,42900.65177,181,48,45,158,19,4,0,0,0,684,2.01812E+14,Local,0,0,0,0,0,1,1
201812239843265_1603309823026826,"If your community group is organising an event, or running a programme that benefits or supports our community, then you could be eligible for a Manurewa Local Board Grant. 
Applications open 19 June - 14 July 2017",Find a grant or fund,link,http://www.aucklandcouncil.govt.nz/EN/newseventsculture/communityfundingsupport/Pages/findagrant.aspx,42899.77292,3,2,4,2,1,0,0,0,0,17,2.01812E+14,Local,0,0,0,0,0,1,1
201812239843265_1629212843769857,"As a community now's the chance to have a voice and help shape the future of Manurewa. You can give your feedback direct to our Facebook page, simply use the phrase ""Local Board Plan feedback"" in your comment, or visit ww.shapeauckland.co.nz by 30 June.",What does Manurewa need over the next three years?,link,http://www.stuff.co.nz/auckland/local-news/manukau-courier/93461116/what-does-manurewa-need-over-the-next-three-years,42897.97083,12,0,5,10,2,0,0,0,0,41,2.01812E+14,Local,0,0,0,0,0,1,1
201812239843265_1633558330001975,History buffs rejoice - Check out Manukau's Journey now at Auckland Libraries.,A timeline of Manukau from 1769 to today,link,http://ourauckland.aucklandcouncil.govt.nz/articles/news/2017/05/a-timeline-of-manukau/,42897.73236,11,0,5,11,0,0,0,0,0,38,2.01812E+14,Local,1,0,0,0,0,0,1
201812239843265_1629257693765372,"If you love 'Rewa"", make sure your voice is heard.  Have your say on the draft Manurewa Local Board Plan, which shapes decisions and projects in our community for the next three years. Visit www.shapeauckland.co.nz to submit your feedback, or post a comment on our Facebook Page, with the words 'Local Board Plan Feedback""",Manurewa Cultural Event: REWA - Love Our Centre,video,https://vimeo.com/217627144,42894.70678,20,3,5,20,0,0,0,0,0,71,2.01812E+14,Local,0,0,0,0,0,1,1
201812239843265_1628023113888830,Want to learn new things? You could be eligible for our new Manurewa Local Board Seniors' Scholarships. Applications close 21 July.,Seniors' scholarships recognise lifelong learning,link,http://ourauckland.aucklandcouncil.govt.nz/articles/news/2017/06/seniors-scholarships-recognise-lifelong-learning/,42893.72688,7,0,0,7,0,0,0,0,0,21,2.01812E+14,Local,0,0,0,0,0,1,1
201812239843265_1624293070928501,"Matariki at Auckland Libraries É?? 10 June - 2 July 2017.
Check in with your local library to discover stories of Matariki;",Matariki at Auckland Libraries,link,http://ourauckland.aucklandcouncil.govt.nz/articles/events/2017/06/matariki-at-auckland-libraries/,42890.90903,1,0,1,1,0,0,0,0,0,4,2.01812E+14,Local,1,0,0,0,0,0,1
201812239843265_1616469678377507,"As a young person, now's the chance to have a voice and help shape the future of your community. You can give your feedback direct to our Facebook page, simply use the phrase ""Local Board Plan feedback"" in your comment, or visit ww.shapeauckland.co.nz by 30 June.",,video,https://www.facebook.com/ManurewaLB/videos/1616469678377507/,42885.84375,20,2,9,19,1,0,0,0,0,73,2.01812E+14,Local,0,0,0,0,0,1,1
201812239843265_1836912879962995,"We're developing our Local Board Plan 2017 and want to know what you think about some of the projects and outcomes we propose focusing on over the next three years.

These include supporting community-led initiatives, continued improvements to the town centre and creating safe and accessible transport services and facilities.

we will be at the Matariki Kite Day, where you can stop by our drop-in session with local board members.

Social media
Comments made through Facebook will be considered:
É?Ω write something on the Manurewa Local Board Facebook page - Facebook.com/ManurewaLB and include 'Local Board Plan feedback'
É?Ω send a private message using Facebook Messenger
to @ManurewaLB and include 'Local Board Plan feedback'.

Head online to shapeauckland.co.nz to read the draft Manurewa Local Board Plan 2017 and to make a submission.","Local Board Plan - Tukutuku Sports and Neighbourhood Centre,",event,https://www.facebook.com/events/1836912879962995/,42883.68022,1,0,0,1,0,0,0,0,0,3,2.01812E+14,Local,0,0,0,0,0,1,1
201812239843265_1325257084237914,"We're developing our Local Board Plan 2017 and want to know what you think about some of the projects and outcomes we propose focusing on over the next three years.

These include supporting community-led initiatives, continued improvements to the town centre and creating safe and accessible transport services and facilities.

Drop into the Clendon Community Centre and learn more about the plan, have a chat, and submit your feedback.

Social media
Comments made through Facebook will be considered:
É?Ω write something on the Manurewa Local Board Facebook page - Facebook.com/ManurewaLB and include 'Local Board Plan feedback'
É?Ω send a private message using Facebook Messenger
to @ManurewaLB and include 'Local Board Plan feedback'.

Head online to shapeauckland.co.nz to read the draft Manurewa Local Board Plan 2017 and to make a submission.",Local Board Plan - Te Matariki Clendon Community Centre,event,https://www.facebook.com/events/1325257084237914/,42883.6749,5,0,0,5,0,0,0,0,0,15,2.01812E+14,Local,0,0,0,0,0,1,1
